[
  {"local_reference_id":"orgref-openid-foundation","canonical_cxo_ecosystem_id":null,"organization_name":"OpenID Foundation","organization_aliases":["OIDF"],"match_status":"unresolved_upstream_crosswalk","match_confidence":null,"upstream_release":null,"upstream_commit":null,"upstream_fingerprint":null,"verification_source":"https://openid.net/","unresolved_reason":"External organization crosswalk not attempted in this media batch.","last_synced_at":null,"workflow_status":"candidate","machine_review_status":"ready_for_human_review","human_review_status":"pending","reviewed_by":null,"reviewed_at":null,"provenance":[{"source_url":"https://openid.net/cg/artificial-intelligence-identity-management-community-group/","accessed_at":"2026-08-15","retrieval_method":"official organization page","exact_locator":"page header","content_hash":null,"batch_id":"BATCH-2026-004","prompt_id":"OEII-MEDIA-RESEARCH","prompt_version":"2.0","notes":null}],"revision_history":[]},
  {"local_reference_id":"orgref-idac","canonical_cxo_ecosystem_id":null,"organization_name":"IDAC Corp.","organization_aliases":["Identity at the Center"],"match_status":"unresolved_upstream_crosswalk","match_confidence":null,"upstream_release":null,"upstream_commit":null,"upstream_fingerprint":null,"verification_source":"https://www.identityatthecenter.com/idaccorp","unresolved_reason":"External organization crosswalk not attempted in this media batch.","last_synced_at":null,"workflow_status":"candidate","machine_review_status":"ready_for_human_review","human_review_status":"pending","reviewed_by":null,"reviewed_at":null,"provenance":[{"source_url":"https://www.identityatthecenter.com/idaccorp","accessed_at":"2026-08-15","retrieval_method":"official organization page","exact_locator":"About","content_hash":null,"batch_id":"BATCH-2026-004","prompt_id":"OEII-MEDIA-RESEARCH","prompt_version":"2.0","notes":null}],"revision_history":[]},
  {"local_reference_id":"orgref-rsm","canonical_cxo_ecosystem_id":null,"organization_name":"RSM","organization_aliases":[],"match_status":"unresolved_upstream_crosswalk","match_confidence":null,"upstream_release":null,"upstream_commit":null,"upstream_fingerprint":null,"verification_source":"https://www.identityatthecenter.com/about","unresolved_reason":"External organization crosswalk not attempted in this media batch.","last_synced_at":null,"workflow_status":"candidate","machine_review_status":"ready_for_human_review","human_review_status":"pending","reviewed_by":null,"reviewed_at":null,"provenance":[{"source_url":"https://www.identityatthecenter.com/about","accessed_at":"2026-08-15","retrieval_method":"official podcast host profile","exact_locator":"The Hosts","content_hash":null,"batch_id":"BATCH-2026-004","prompt_id":"OEII-MEDIA-RESEARCH","prompt_version":"2.0","notes":null}],"revision_history":[]},
  {"local_reference_id":"orgref-sailpoint","canonical_cxo_ecosystem_id":null,"organization_name":"SailPoint Technologies","organization_aliases":["SailPoint"],"match_status":"unresolved_upstream_crosswalk","match_confidence":null,"upstream_release":null,"upstream_commit":null,"upstream_fingerprint":null,"verification_source":"https://developer.sailpoint.com/discuss/t/governing-ai-agents-with-agent-identity-security/188944","unresolved_reason":"External organization crosswalk not attempted in this media batch.","last_synced_at":null,"workflow_status":"candidate","machine_review_status":"ready_for_human_review","human_review_status":"pending","reviewed_by":null,"reviewed_at":null,"provenance":[{"source_url":"https://developer.sailpoint.com/discuss/t/governing-ai-agents-with-agent-identity-security/188944","accessed_at":"2026-08-15","retrieval_method":"official publisher page","exact_locator":"publisher and embedded recording","content_hash":null,"batch_id":"BATCH-2026-004","prompt_id":"OEII-MEDIA-RESEARCH","prompt_version":"2.0","notes":null}],"revision_history":[]},
  {"local_reference_id":"orgref-cloud-security-alliance","canonical_cxo_ecosystem_id":null,"organization_name":"Cloud Security Alliance","organization_aliases":["CSA"],"match_status":"unresolved_upstream_crosswalk","match_confidence":null,"upstream_release":null,"upstream_commit":null,"upstream_fingerprint":null,"verification_source":"https://cloudsecurityalliance.org/","unresolved_reason":"External organization crosswalk not attempted in this media batch.","last_synced_at":null,"workflow_status":"candidate","machine_review_status":"ready_for_human_review","human_review_status":"pending","reviewed_by":null,"reviewed_at":null,"provenance":[{"source_url":"https://cloudsecurityalliance.org/artifacts/securing-non-human-identities-in-the-age-of-ai-agents-rsac-2025","accessed_at":"2026-08-15","retrieval_method":"official organization artifact page","exact_locator":"page header","content_hash":null,"batch_id":"BATCH-2026-004","prompt_id":"OEII-MEDIA-RESEARCH","prompt_version":"2.0","notes":null}],"revision_history":[]},
  {"local_reference_id":"orgref-astrix-security","canonical_cxo_ecosystem_id":null,"organization_name":"Astrix Security","organization_aliases":["Astrix"],"match_status":"unresolved_upstream_crosswalk","match_confidence":null,"upstream_release":null,"upstream_commit":null,"upstream_fingerprint":null,"verification_source":"https://cloudsecurityalliance.org/artifacts/securing-non-human-identities-in-the-age-of-ai-agents-rsac-2025","unresolved_reason":"Current corporate status and upstream match require separate verification.","last_synced_at":null,"workflow_status":"candidate","machine_review_status":"ready_for_human_review","human_review_status":"pending","reviewed_by":null,"reviewed_at":null,"provenance":[{"source_url":"https://cloudsecurityalliance.org/artifacts/securing-non-human-identities-in-the-age-of-ai-agents-rsac-2025","accessed_at":"2026-08-15","retrieval_method":"official event artifact page","exact_locator":"presenter role at source time","content_hash":null,"batch_id":"BATCH-2026-004","prompt_id":"OEII-MEDIA-RESEARCH","prompt_version":"2.0","notes":null}],"revision_history":[]},
  {"local_reference_id":"orgref-workday","canonical_cxo_ecosystem_id":null,"organization_name":"Workday","organization_aliases":[],"match_status":"unresolved_upstream_crosswalk","match_confidence":null,"upstream_release":null,"upstream_commit":null,"upstream_fingerprint":null,"verification_source":"https://cloudsecurityalliance.org/artifacts/securing-non-human-identities-in-the-age-of-ai-agents-rsac-2025","unresolved_reason":"External organization crosswalk not attempted in this media batch.","last_synced_at":null,"workflow_status":"candidate","machine_review_status":"ready_for_human_review","human_review_status":"pending","reviewed_by":null,"reviewed_at":null,"provenance":[{"source_url":"https://cloudsecurityalliance.org/artifacts/securing-non-human-identities-in-the-age-of-ai-agents-rsac-2025","accessed_at":"2026-08-15","retrieval_method":"official event artifact page","exact_locator":"presenter role at source time","content_hash":null,"batch_id":"BATCH-2026-004","prompt_id":"OEII-MEDIA-RESEARCH","prompt_version":"2.0","notes":null}],"revision_history":[]},
  {"local_reference_id":"orgref-capital-one","canonical_cxo_ecosystem_id":null,"organization_name":"Capital One","organization_aliases":[],"match_status":"unresolved_upstream_crosswalk","match_confidence":null,"upstream_release":null,"upstream_commit":null,"upstream_fingerprint":null,"verification_source":"https://identiverse.com/idv26/session/?idvid=3931776","unresolved_reason":"External organization crosswalk not attempted in this media batch.","last_synced_at":null,"workflow_status":"candidate","machine_review_status":"ready_for_human_review","human_review_status":"pending","reviewed_by":null,"reviewed_at":null,"provenance":[{"source_url":"https://identiverse.com/idv26/session/?idvid=3931776","accessed_at":"2026-08-15","retrieval_method":"official event session page","exact_locator":"speaker employer","content_hash":null,"batch_id":"BATCH-2026-004","prompt_id":"OEII-MEDIA-RESEARCH","prompt_version":"2.0","notes":null}],"revision_history":[]},
  {"local_reference_id":"orgref-identiverse","canonical_cxo_ecosystem_id":null,"organization_name":"Identiverse","organization_aliases":[],"match_status":"unresolved_upstream_crosswalk","match_confidence":null,"upstream_release":null,"upstream_commit":null,"upstream_fingerprint":null,"verification_source":"https://identiverse.com/idv26/","unresolved_reason":"External organization crosswalk not attempted in this media batch.","last_synced_at":null,"workflow_status":"candidate","machine_review_status":"ready_for_human_review","human_review_status":"pending","reviewed_by":null,"reviewed_at":null,"provenance":[{"source_url":"https://identiverse.com/idv26/session/?idvid=3931776","accessed_at":"2026-08-15","retrieval_method":"official event session page","exact_locator":"event header","content_hash":null,"batch_id":"BATCH-2026-004","prompt_id":"OEII-MEDIA-RESEARCH","prompt_version":"2.0","notes":null}],"revision_history":[]},